{
  "schema_version": "xcp-creative-host-profile-v1",
  "profile_id": "xcp.creative.host.development-v1",
  "host_api_version": "0.6.0",
  "implementation_stage": "development_candidate",
  "project_schema_versions": [
    "xcp-creative-project-v1"
  ],
  "bundle_schema_versions": [
    "xcp-creative-bundle-v1"
  ],
  "module_kinds": [
    {
      "id": "xcp.canvas2d.v1",
      "schema_id": "xcp.canvas2d.module-schema-v1",
      "schema_sha256": "8c0a290c3561ab277e51b2fa2d2a624a8ec89804d2ce2984cb0212e4ca784781",
      "admitted": true,
      "required_capabilities": [
        "input.gamepad",
        "render.canvas2d"
      ]
    },
    {
      "id": "xcp.ui.v1",
      "schema_id": "xcp.ui.module-schema-v1",
      "schema_sha256": "46b5371ae7ec872c652cfdd44587c54d77bbcf172a6cd4038387d6e93216e7d4",
      "admitted": true,
      "required_capabilities": [
        "input.gamepad",
        "ui.controller"
      ]
    },
    {
      "id": "xcp.behavior.v1",
      "schema_id": "xcp.behavior.module-schema-v1",
      "schema_sha256": "e498f7bf9138d788135b41392820d9889c2040d6158d3686dde3352fc1e1c84c",
      "admitted": true,
      "required_capabilities": [
        "behavior.deterministic"
      ]
    },
    {
      "id": "xcp.data.v1",
      "schema_id": "xcp.data.module-schema-v1",
      "schema_sha256": "9526c63af6768dfeda8362cf2cd8ee42b06e922affb79227171fe173b38af593",
      "admitted": true,
      "required_capabilities": [
        "state.local"
      ]
    },
    {
      "id": "xcp.world2d.v1",
      "schema_id": "xcp.world2d.module-schema-v1",
      "schema_sha256": "2071b8d01fee254f1a2f9eb0584701f5e65092c0cdced88958819afacf6b993f",
      "admitted": true,
      "required_capabilities": [
        "input.gamepad",
        "render.canvas2d",
        "world2d.deterministic"
      ]
    },
    {
      "id": "xcp.world2d.v2",
      "schema_id": "xcp.world2d.module-schema-v2",
      "schema_sha256": "d9cd76927278184ea4f7fb4b5cdb7567076ce59c39eaa331912577f2c94da350",
      "admitted": true,
      "required_capabilities": [
        "input.gamepad",
        "render.canvas2d",
        "render.sprite_atlas",
        "world2d.deterministic",
        "world2d.gravity"
      ]
    },
    {
      "id": "xcp.world2d.campaign.v1",
      "schema_id": "xcp.world2d.campaign-module-schema-v1",
      "schema_sha256": "0d618a3e2b0820d8dff3eaf3392f2675f791113ca95bcc3b032637bc7296e8cc",
      "admitted": true,
      "required_capabilities": [
        "input.gamepad",
        "render.canvas2d",
        "render.sprite_atlas",
        "state.local",
        "world2d.campaign",
        "world2d.deterministic",
        "world2d.gravity"
      ]
    },
    {
      "id": "xcp.world2d.motion.v1",
      "schema_id": "xcp.world2d.motion-module-schema-v1",
      "schema_sha256": "5566d64a3b653ca6f7a6179908cf8a040b3f9f8f85fa76d31fe6e10b6136c455",
      "admitted": true,
      "required_capabilities": [
        "world2d.fixed-step-interpolation",
        "world2d.incremental-gravity"
      ]
    },
    {
      "id": "xcp.scene3d.v1",
      "schema_id": "xcp.scene3d.module-schema-v1",
      "schema_sha256": "0ced407b911e487e28084adec9afe05b9da0e44b5169c62fe2358253dd274d23",
      "admitted": true,
      "required_capabilities": [
        "animation.scene3d",
        "collision.basic",
        "input.gamepad",
        "render.scene3d"
      ]
    },
    {
      "id": "xcp.audio.v1",
      "schema_id": "xcp.audio.module-schema-v1",
      "schema_sha256": "f0981c3574d57f10b5d59a08084aa4212278ef13f68be2c11a9c6f73ede717ef",
      "admitted": true,
      "required_capabilities": [
        "audio.playback"
      ]
    },
    {
      "id": "xcp.xvm.v2",
      "schema_id": "xcp.xvm.module-schema-v1",
      "schema_sha256": "148b06457ff30ba2ac50152061a94b27632dcb906a767b1a6591cd2cf152e267",
      "admitted": true,
      "required_capabilities": [
        "xvm.cpu-reference"
      ]
    }
  ],
  "asset_formats": [
    {
      "id": "xcp.sprite.png.v1",
      "media_type": "image/png",
      "decoder": "xcp.decoder.wic-png.v1",
      "admitted": true,
      "usages": [
        "canvas2d.sprite",
        "world2d.sprite_atlas"
      ],
      "limits": {
        "max_file_bytes": 16777216,
        "max_width": 4096,
        "max_height": 4096,
        "max_decoded_bytes": 67108864
      }
    },
    {
      "id": "xcp.mesh.asset.v1",
      "media_type": "application/vnd.xcp.mesh-v1+json",
      "decoder": "xcp.decoder.mesh-json.v1",
      "schema_id": "xcp.mesh.asset-schema-v1",
      "schema_sha256": "bb3a1f80b709f398187525deba8309790e77034e5088e7ddc6c4d5d0cea95ed9",
      "admitted": true,
      "usages": [
        "scene3d.mesh"
      ],
      "limits": {
        "max_file_bytes": 16777216,
        "max_vertices": 65536,
        "max_indices": 196608
      }
    },
    {
      "id": "xcp.audio.pcm-wav.v1",
      "media_type": "audio/wav",
      "decoder": "xcp.decoder.pcm-wav.v1",
      "admitted": true,
      "usages": [
        "audio.clip"
      ],
      "limits": {
        "max_file_bytes": 16777216,
        "max_decoded_bytes": 16777216
      }
    },
    {
      "id": "xcp.xvm.program-v2",
      "media_type": "application/vnd.xcp.xvm-program-v2+json",
      "decoder": "xcp.decoder.xvm-v2-verifier.v1",
      "admitted": true,
      "usages": [
        "xvm.service-program"
      ],
      "limits": {
        "max_file_bytes": 1048576
      }
    }
  ],
  "capabilities": [
    {"id": "animation.scene3d", "admitted": true},
    {"id": "audio.playback", "admitted": true},
    {"id": "behavior.deterministic", "admitted": true},
    {"id": "collision.basic", "admitted": true},
    {"id": "input.gamepad", "admitted": true},
    {"id": "render.canvas2d", "admitted": true},
    {"id": "render.sprite_atlas", "admitted": true},
    {"id": "render.scene3d", "admitted": true},
    {"id": "state.local", "admitted": true},
    {"id": "ui.controller", "admitted": true},
    {"id": "world2d.deterministic", "admitted": true},
    {"id": "world2d.campaign", "admitted": true},
    {"id": "world2d.fixed-step-interpolation", "admitted": true},
    {"id": "world2d.gravity", "admitted": true},
    {"id": "world2d.incremental-gravity", "admitted": true},
    {"id": "xvm.cpu-reference", "admitted": true}
  ],
  "budgets": {
    "max_module_count": 128,
    "max_asset_count": 256,
    "max_file_count": 384,
    "max_file_bytes": 4294967296,
    "max_bundle_manifest_bytes": 4194304,
    "max_module_document_bytes": 16777216,
    "max_project_bytes": 4294967296,
    "max_installed_workspace_bytes": 8589934592,
    "max_modules_per_kind": 128,
    "max_local_state_bytes": 8388608,
    "max_scene_animations": 256,
    "max_scene_triangles": 65536,
    "max_runtime_logs": 256,
    "max_audio_clips": 128,
    "max_audio_voices": 32,
    "max_audio_pcm_bytes": 16777216,
    "max_xvm_services": 32,
    "max_xvm_program_bytes": 1048576,
    "max_xvm_fuel_per_invocation": 1000000,
    "max_xvm_memory_bytes": 1048576,
    "max_xvm_output_bytes": 1048576,
    "max_xvm_invocations_per_dispatch": 32,
    "max_world2d_tiles": 65536,
    "max_world2d_entities": 4096,
    "max_world2d_objectives": 256,
    "max_world2d_actions_per_dispatch": 64
  },
  "operations": {
    "install": true,
    "activate": true,
    "list": true,
    "remove": true,
    "rollback": true,
    "launch": true,
    "reload": true,
    "dispatch_input": true,
    "capture": true
  },
  "lifecycle": {
    "schema_version": "xcp-creative-lifecycle-v1",
    "admission": "development_candidate_not_live_admitted",
    "staging_surface": "existing_worker_artifacts",
    "installed_record_schema_version": "xcp-creative-installed-bundle-v1",
    "activation_record_schema_version": "xcp-creative-activation-record-v1",
    "atomic_activation": "append_only_hash_chained_record",
    "cas_reference_protection": true,
    "commands": {
      "prepare": {
        "command": "prepare_creative_install",
        "request_schema_version": "xcp-creative-prepare-install-request-v1"
      },
      "commit": {
        "command": "commit_creative_install",
        "request_schema_version": "xcp-creative-commit-install-request-v1"
      },
      "list": {
        "command": "list_creative_installs",
        "request_schema_version": "xcp-creative-list-installs-request-v1"
      },
      "activate": {
        "command": "activate_creative_install",
        "request_schema_version": "xcp-creative-activate-install-request-v1"
      },
      "rollback": {
        "command": "rollback_creative_activation",
        "request_schema_version": "xcp-creative-rollback-activation-request-v1"
      },
      "remove": {
        "command": "remove_creative_install",
        "request_schema_version": "xcp-creative-remove-install-request-v1"
      },
      "launch": {
        "command": "launch_creative_project",
        "request_schema_version": "xcp-creative-launch-request-v1"
      },
      "reload": {
        "command": "reload_creative_project",
        "request_schema_version": "xcp-creative-reload-request-v1"
      },
      "observe": {
        "command": "observe_creative_foreground",
        "request_schema_version": "xcp-creative-observation-request-v1"
      },
      "dispatch_input": {
        "command": "dispatch_creative_input",
        "request_schema_version": "xcp-creative-input-dispatch-request-v1"
      },
      "capture": {
        "command": "capture_creative_frame",
        "request_schema_version": "xcp-creative-frame-capture-request-v1"
      }
    }
  },
  "observations": [
    "foreground.frame-status",
    "foreground.frame-capture-bgra",
    "foreground.audio-cue-count",
    "foreground.audio-voice-count",
    "foreground.logs-snapshot",
    "foreground.state-snapshot",
    "foreground.world2d-state",
    "foreground.xvm-invocation-count"
  ],
  "claim_boundary": {
    "native_payload_upload": false,
    "runtime_shader_compilation": false,
    "process_creation": false,
    "broad_filesystem_access": false,